{
  "catalog_schema_version": 1,
  "coverage": {
    "description_note_definitions": false,
    "evolutions": true,
    "pets": true,
    "skill_stone_topics": false,
    "skills": true,
    "topic_rewards": false
  },
  "data_version": 2,
  "database_asset": "assets/catalog/catalog.db",
  "database_bytes": 4657152,
  "database_sha256": "dce0d3376611adc151f8e2abe1f74185d19c94f61a3d0d2fade98a188dae9d61",
  "dataset_id": "roco-world-zh-cn",
  "manifest_version": 1,
  "snapshot_id": "snapshot-dad7cd7d5ce73236"
}
